Name,Title,Body
N/A,N/A,voluptatem perspiciatis voluptatum quaerat odit voluptates iure quisquam magnam voluptates ut non qui aliquam aut ut amet sit consequatur ut suscipit
N/A,N/A,est sed illo omnis delectus aut laboriosam possimus incidunt est sunt at nemo voluptas ex ipsam voluptatibus inventore velit sit et numquam omnis accusamus in
N/A,N/A,occaecati tempora unde maiores aliquid in quo libero sint quidem at est facilis ipsa facere nostrum atque harum
N/A,N/A,pariatur veniam repellat quisquam tempore autem et voluptatem itaque ea impedit ex molestiae placeat hic harum mollitia dolorem inventore accusantium aut quae quia rerum autem numquam nulla culpa quasi dolor
N/A,N/A,nisi dicta numquam dolor rerum sed quaerat et sed sequi doloribus libero quos temporibus blanditiis optio est tempore qui
N/A,N/A,eos officiis omnis ab laborum nulla saepe exercitationem recusandae voluptate minima voluptatem sint sunt est consequuntur dolor voluptatem odit maxime similique deserunt et quod
N/A,N/A,fugiat dicta quasi voluptatibus ea aut est aspernatur sed corrupti harum non omnis eos eaque quos ut quia et et nisi rerum voluptates possimus quis recusandae aperiam quia esse
N/A,N/A,ut est veritatis animi quos nam sed dolor itaque omnis nostrum autem molestiae aut optio tempora ad sapiente quae voluptatem perferendis repellat
N/A,N/A,voluptatem est aspernatur consequatur vel facere ut omnis tenetur non ea eos quibusdam error odio atque consectetur voluptatem eligendi
N/A,N/A,quasi dolorem veniam dignissimos atque voluptas iure et quidem fugit velit et quod magnam illum quia et ea est modi aut quis dolores
N/A,N/A,eos exercitationem est ut voluptas accusamus qui velit rerum ut dolorem eaque omnis eligendi mollitia atque ea architecto dolorum delectus accusamus
N/A,N/A,molestiae accusantium a tempore occaecati qui sunt optio eos exercitationem quas eius voluptatem omnis quibusdam autem molestiae odio dolor quam laboriosam mollitia in quibusdam sunt
N/A,N/A,voluptatem omnis pariatur aut saepe enim qui aut illo aut sed aperiam expedita debitis tempore animi dolorem ut libero et eos unde ex
N/A,N/A,dolorem fugit quidem animi quas quisquam reprehenderit occaecati et dolor laborum nemo sed quas unde deleniti facere eligendi placeat aliquid aspernatur commodi sunt impedit neque corrupti alias molestiae magni tempora
N/A,N/A,dolore maxime saepe dolor asperiores cupiditate nisi nesciunt vitae tempora ducimus vel eos perferendis fuga sequi numquam blanditiis sit sed inventore et ut possimus soluta voluptas nihil aliquid sed earum
N/A,N/A,fuga aut est delectus earum optio impedit qui excepturi iusto consequatur deserunt soluta sunt et autem neque dolor ut saepe dolores assumenda ipsa eligendi
N/A,N/A,sit nesciunt id vitae ut itaque sapiente neque in at consequuntur perspiciatis dicta consequatur velit facilis iste ut error sed in sequi expedita autem
N/A,N/A,minus ab quis nihil quia suscipit vel perspiciatis sunt unde aut ullam quo laudantium deleniti modi rerum illo error occaecati vel officiis facere
N/A,N/A,repellendus quae labore sunt ut praesentium fuga reiciendis quis corporis aut quis dolor facere earum exercitationem enim sunt nihil asperiores expedita eius nesciunt a sit sit
N/A,N/A,ab veritatis aspernatur molestiae explicabo ea saepe molestias sequi beatae aut perferendis quaerat aut omnis illo fugiat quisquam hic doloribus maiores itaque voluptas amet dolorem blanditiis
N/A,N/A,sit tenetur aut eum quasi reiciendis dignissimos non nulla repellendus ut quisquam numquam provident et repellendus eum nihil blanditiis beatae iusto sed eius sit sed doloremque exercitationem nihil
N/A,N/A,officiis ipsa exercitationem impedit dolorem repellat adipisci qui atque illum sapiente omnis et nihil esse et eum facilis aut impedit maxime ullam et dolorem
N/A,N/A,impedit qui nemo reprehenderit sequi praesentium ullam veniam quaerat optio qui error aperiam qui quisquam dolor est blanditiis molestias rerum et quae quam eum odit ab quia est ut
N/A,N/A,quae quis qui ab rerum non hic consequatur earum facilis atque quas dolore fuga ipsam nihil velit quis rerum sit nam est nulla nihil qui excepturi et
N/A,N/A,officia provident libero explicabo tempora velit eligendi mollitia similique rerum sit aut consequatur ullam tenetur qui est vero rerum est et explicabo sit sunt ea exercitationem molestiae
N/A,N/A,ipsa id eum dolorum et officiis saepe eos voluptatem nesciunt quos voluptas temporibus dolores ad rerum non voluptatem aut fugit
N/A,N/A,corporis quo magnam sunt rerum enim vel repudiandae suscipit corrupti ut ab qui debitis quidem adipisci distinctio voluptatibus vitae molestias incidunt laboriosam quia quidem facilis quia architecto libero illum ut dicta
N/A,N/A,sunt cupiditate commodi est pariatur incidunt quis suscipit saepe magnam amet enim quod quis neque et modi rerum asperiores consequatur reprehenderit maiores
N/A,N/A,repudiandae dolores nam quas et incidunt odio dicta eum vero dolor quidem dolorem quisquam cumque molestiae neque maxime rerum deserunt nam sequi
N/A,N/A,consequatur qui doloribus et rerum debitis cum dolorem voluptate qui fuga necessitatibus quod temporibus non voluptates aut saepe molestiae
N/A,N/A,quam iste aut molestiae nesciunt modi atque quo laudantium vel tempora quam tenetur neque aut et ipsum eum nostrum enim laboriosam officia eligendi laboriosam libero ullam sit nulla voluptate in
N/A,N/A,distinctio placeat nisi repellat animi sed praesentium voluptatem placeat eos blanditiis deleniti natus eveniet dolorum quia tempore pariatur illum dolor aspernatur ratione tenetur autem ipsum fugit
N/A,N/A,occaecati quia ipsa id fugit sunt velit iure adipisci ullam inventore quidem dolorem adipisci optio quia et quis explicabo omnis ipsa quo ut voluptatem aliquam inventore minima aut tempore excepturi similique
N/A,N/A,nihil consequatur dolorem voluptatem non molestiae odit eum animi ipsum omnis ut quasi voluptas sed et et qui est aut
N/A,N/A,ea necessitatibus eum nesciunt corporis minus in quisquam iste recusandae qui nobis deleniti asperiores non laboriosam sunt molestiae dolore distinctio qui officiis tempora dolorem ea
N/A,N/A,id molestiae doloribus omnis atque eius sunt aperiam tenetur quia natus nihil sunt veritatis recusandae quia corporis quam omnis veniam voluptas amet quidem illo deleniti
N/A,N/A,explicabo dicta quas cum quis rerum dignissimos et magnam sit mollitia est dolor voluptas sed ipsum et tenetur recusandae quod facilis nulla amet deserunt
N/A,N/A,ipsam eum ea distinctio ducimus saepe eos quaerat molestiae corporis aut officia qui ut perferendis itaque possimus incidunt aut quis
N/A,N/A,qui vero recusandae porro esse sint doloribus impedit voluptatem commodi asperiores laudantium ut dolores praesentium distinctio magnam voluptatum aut
N/A,N/A,perspiciatis vero nulla aut consequatur fuga earum aut nemo suscipit totam vitae qui at omnis aut incidunt optio dolorem voluptatem vel assumenda vero id explicabo deleniti sit corrupti sit
N/A,N/A,consequatur ut aut placeat harum quia perspiciatis unde doloribus quae non ut modi ad unde ducimus omnis nobis voluptatem atque magnam reiciendis dolorem et qui explicabo
N/A,N/A,molestiae minima aut rerum nesciunt vitae iusto consequatur architecto assumenda dolorum non doloremque tempora possimus qui mollitia omnis vitae odit sed
N/A,N/A,nulla corrupti delectus est cupiditate explicabo facere sapiente quo id quis illo culpa ut aut sit error magni atque asperiores soluta aut cumque voluptatem occaecati omnis aliquid
N/A,N/A,dolores tenetur rerum et aliquam culpa officiis ea rem neque modi quaerat deserunt molestias minus nesciunt iusto impedit enim laborum perferendis velit minima itaque voluptatem fugiat
N/A,N/A,maxime incidunt velit quam vel fugit nostrum veritatis et ipsam nisi voluptatem voluptas cumque tempora velit et et quisquam error maiores fugit qui dolor sit doloribus
N/A,N/A,voluptas iste deleniti est itaque vel ea incidunt quia voluptates sapiente repellat aut consectetur vel neque tempora esse similique sed a qui nobis voluptate hic eligendi doloribus molestiae et
N/A,N/A,et dolor error doloremque odio quo sunt quod est ipsam assumenda in veniam illum rerum deleniti expedita voluptate hic nostrum sed dolor et qui
N/A,N/A,et voluptatibus est et aperiam quaerat voluptate eius quo nihil voluptas doloribus et ea tempore labore non dolorem optio consequatur est id quia magni voluptas enim
N/A,N/A,hic et et aspernatur voluptates voluptas ut ut id excepturi eligendi aspernatur nulla dicta ab suscipit quis distinctio nihil temporibus unde quasi expedita et inventore consequatur rerum ab
N/A,N/A,similique autem voluptatem ab et et odio animi repellendus libero voluptas voluptas quia libero facere saepe nobis consequatur et qui non hic ea maxime nihil
N/A,N/A,est ut aut ut omnis distinctio illum quisquam pariatur qui aspernatur vitae dolor explicabo architecto veritatis ipsa et aut est molestiae ducimus et sapiente error sed omnis
N/A,N/A,maiores totam quo atque explicabo perferendis iste facilis odio ab eius consequatur sit praesentium ea vitae optio minus voluptate necessitatibus omnis itaque omnis qui
N/A,N/A,dicta dolorem veniam ipsa harum minus sequi omnis quia voluptatem autem est optio doloribus repellendus id commodi quas exercitationem eum et eum dignissimos accusamus est eaque doloremque
N/A,N/A,est aut consequatur error illo ut enim nihil fuga suscipit inventore officiis iure earum pariatur temporibus in aperiam qui quod vel necessitatibus velit eos exercitationem culpa
N/A,N/A,iure ea ea neque est esse ab sed hic et ullam sed sequi a non hic tenetur sunt enim ea laudantium ea natus
N/A,N/A,quis beatae qui sequi dicta quas et dolor non enim aspernatur excepturi aut rerum asperiores aliquid animi nulla ea tempore esse
N/A,N/A,ea alias eos et corrupti voluptatem ab incidunt voluptatibus voluptas ea nesciunt totam corporis dolor recusandae voluptas harum
N/A,N/A,iusto nihil quae rerum laborum recusandae voluptatem et necessitatibus ut deserunt cumque qui qui non et et eos adipisci cupiditate dolor sed voluptates maiores commodi eveniet consequuntur
N/A,N/A,omnis et fugit eos sint saepe ipsam unde est dolores sit sit assumenda laboriosam dolor deleniti voluptatem id nesciunt et placeat dolorem cumque laboriosam sunt non
N/A,N/A,quas non magnam quia veritatis assumenda reiciendis similique dolores est ab praesentium fuga ut
N/A,N/A,consectetur illo corporis sit labore optio quod qui occaecati aut sequi quia officiis quia aut odio quo ad rerum tenetur aut quasi veniam
N/A,N/A,perferendis dignissimos soluta ut provident sit et delectus ratione ad sapiente qui excepturi error qui quo quo illo commodi rerum maxime voluptas voluptatem
N/A,N/A,dicta impedit non et laborum laudantium qui eaque et beatae suscipit sequi magnam rem dolorem non quia vel adipisci corrupti officiis laudantium impedit
N/A,N/A,eaque rerum tempore distinctio consequatur fugiat veniam et incidunt ut ut et consequatur blanditiis magnam doloremque voluptate ut architecto facere in dolorem et aut
N/A,N/A,quo nisi impedit velit repellendus esse itaque ut saepe voluptatibus occaecati ab eaque dolores maxime alias velit ducimus placeat sit laudantium quia corrupti doloremque ut
N/A,N/A,dolorem eius voluptatem vitae aliquid unde labore est molestiae labore dolorem beatae voluptatem soluta eum eos dolore et ea quasi aut doloribus sint vel suscipit tempora delectus soluta
N/A,N/A,nemo aut laborum expedita nisi sed illum ab asperiores provident a sunt recusandae ut rerum itaque est voluptatibus nihil esse ipsum et repellendus nobis rerum voluptas et
N/A,N/A,delectus est consequatur at excepturi asperiores dolor nesciunt ad id non aut ad ut non et voluptatem
N/A,N/A,vel cumque labore vitae quisquam magnam sequi ut molestiae dolores vel minus aut quas repellat nostrum fugit molestiae veritatis sequi vel quidem in molestiae id doloribus sed
N/A,N/A,fugiat dolore voluptas tempore aspernatur quibusdam rem iste sit fugiat nesciunt consequatur dolor sed odit similique minima corporis quae in adipisci impedit dolores et cupiditate accusantium perferendis dignissimos error
N/A,N/A,et eos est quis quia molestiae est quasi est quos omnis aut et sit consectetur ex molestiae est sed accusamus asperiores
N/A,N/A,unde ad id nemo ipsam dolorem autem quaerat perspiciatis voluptas corrupti laborum rerum est architecto eius quos aut et voluptate voluptatem atque necessitatibus voluptate fugiat aut iusto et atque
N/A,N/A,et explicabo voluptatem ut est nihil culpa et veritatis repellendus ipsum velit qui eligendi maxime voluptatem est dicta rerum et et nemo quia eveniet aspernatur nostrum molestiae mollitia ut dolores rem fugiat
N/A,N/A,sit et aut recusandae corrupti nisi vero eius nulla voluptates voluptatem placeat est commodi impedit odio omnis similique debitis et in molestiae omnis sed non magni
N/A,N/A,cum ad porro fuga sequi dolores ipsa error magni itaque labore accusamus corporis odit consequatur quis debitis cum et voluptas facilis incidunt ut itaque dolores error
N/A,N/A,excepturi omnis occaecati officiis enim saepe id non quo et dignissimos voluptates ipsum molestias facere dolorem qui iure similique corrupti neque ducimus sit alias dolor earum autem doloribus consequatur
N/A,N/A,est magni totam est et enim nam voluptas veritatis est sint doloremque incidunt et cum a et eligendi nobis ratione delectus
N/A,N/A,architecto quo enim ad et reprehenderit laboriosam quia commodi officia iusto dolorem totam consequuntur cupiditate veritatis voluptates aspernatur earum saepe et sed consequatur
N/A,N/A,modi sed aut quidem quisquam optio est aut facilis sit quia quis facere quod fugiat recusandae ex et quisquam ipsum sed sit exercitationem quia recusandae dolorem quasi iusto ipsa qui et
N/A,N/A,explicabo perspiciatis quae sit qui nulla incidunt facilis repudiandae perspiciatis voluptate expedita sunt consectetur quasi id occaecati nesciunt dolorem aliquid perspiciatis repellat inventore esse ut possimus exercitationem facere modi
N/A,N/A,nostrum modi et et dolores maxime facere alias doloribus eaque expedita et similique voluptatum magnam est omnis eos voluptatem et unde fugit voluptatem asperiores
N/A,N/A,est dolor eveniet est minus eveniet recusandae iure quo aut eos ut sed ipsa harum earum aut nesciunt non dolores
N/A,N/A,qui fugit accusamus et quo minus cumque hic adipisci odio blanditiis omnis et est architecto et facilis inventore quasi provident quaerat ex rem
N/A,N/A,beatae hic est et deserunt eius corrupti quam ut commodi sit modi est corporis animi harum ut est aperiam non fugit excepturi quo tenetur totam
N/A,N/A,est dicta totam architecto et minus id aut non ut et fugit eaque culpa modi repellendus aliquid qui veritatis doloribus aut consequatur voluptas sequi accusantium voluptas occaecati saepe reprehenderit ut
N/A,N/A,aut illum est asperiores rerum laboriosam quis sit dolores magni minima fuga atque omnis at et quibusdam earum rem earum distinctio autem et enim dolore eos
N/A,N/A,iure aliquid qui sit excepturi dolorem rerum possimus suscipit atque nisi labore ut aut nihil voluptatum ut aliquid praesentium assumenda tempore dolor velit ratione et corrupti
N/A,N/A,eligendi et consequuntur dolor nihil quaerat doloremque ut dignissimos sunt veniam non ratione esse debitis omnis similique maxime dolores tempora laborum rerum adipisci reiciendis explicabo error quidem quo necessitatibus voluptatibus vitae ipsum
N/A,N/A,non ea sed reprehenderit reiciendis eaque et neque adipisci ipsa architecto deserunt ratione nesciunt tempore similique occaecati non hic vitae sit neque rerum quod dolorem ratione esse aperiam necessitatibus
N/A,N/A,sint qui aut aspernatur necessitatibus laboriosam autem occaecati nostrum non officiis consequuntur odit et itaque quam placeat aut molestiae saepe veniam provident
N/A,N/A,sint fugit et id et saepe non molestiae sit earum doloremque dolorem nemo earum dignissimos ipsa soluta deleniti quos quis numquam ducimus sed corporis dolores sed quisquam suscipit
N/A,N/A,est molestiae non fugiat voluptatem quo porro aut praesentium ipsam aspernatur perferendis fuga officia sit ut aspernatur rerum est
N/A,N/A,laboriosam quia animi ut quasi aut enim sequi numquam similique fugiat voluptatum non sed velit quod nisi id quidem magni in eveniet hic
N/A,N/A,voluptatum quis ipsa voluptatem saepe est illum error repellat eaque dolor quae qui eum rerum sunt quam illo voluptates fuga possimus nemo nihil distinctio
N/A,N/A,consequatur possimus sit itaque distinctio fugit aut quod explicabo exercitationem voluptas labore rerum porro ut in voluptas maiores tempora accusantium voluptatum et sapiente sit quas quis et veniam
N/A,N/A,eaque eius delectus molestias suscipit nulla quisquam totam vel quos et autem sed eligendi et pariatur earum molestias magnam autem placeat culpa est et qui commodi illo et
N/A,N/A,qui quaerat id repellendus aut qui maiores quidem consequatur dignissimos deleniti deserunt eveniet libero a repellat ducimus quia aut dignissimos numquam molestiae consequatur sit impedit nostrum et sunt iure
N/A,N/A,blanditiis dolor sint nulla cum quidem aliquid voluptatem perferendis dolor consequatur voluptas et ut quisquam tempora tenetur maxime minus animi qui id eum accusantium et optio et blanditiis maxime
N/A,N/A,sit fugiat est autem quia ipsam error ab voluptatem sed ab labore molestiae qui debitis exercitationem non et sunt officia illo possimus iste tenetur est dolores voluptas ad aspernatur nihil
N/A,N/A,et dicta dolores sit repudiandae id harum temporibus voluptas quia blanditiis numquam a enim quae quisquam assumenda nam doloribus vel temporibus distinctio eveniet dolores
N/A,N/A,qui recusandae veniam sed voluptatem ullam facilis consequatur numquam ut quod aut et non alias ex quam aut quasi ipsum praesentium ut aspernatur sit
N/A,N/A,facilis et totam voluptatibus est optio cum facilis qui aut blanditiis rerum voluptatem accusamus et omnis quasi sint
N/A,N/A,dolore nihil perferendis dolor hic repudiandae iste doloribus labore quaerat et molestiae dolores sit excepturi sint et eum et aut
N/A,N/A,dolor ratione ab repellendus aut quia reiciendis sed est alias ex odio voluptatem velit odit tempora nihil optio aperiam blanditiis labore porro id velit dolor veritatis
N/A,N/A,aut repellat tenetur delectus eaque est nihil consequatur quae deleniti assumenda voluptates sit sit cupiditate maiores autem suscipit sint tenetur dolor tempore dolorem dolorum alias adipisci
N/A,N/A,aut aut ea ut repudiandae ea assumenda laboriosam sunt qui laboriosam dicta omnis sit corporis voluptas eos amet quam quisquam officiis facilis laborum voluptatibus accusantium ab aliquid sed id doloremque
N/A,N/A,et quia explicabo ut hic commodi quas provident aliquam nihil vitae in voluptatem commodi vero velit optio omnis accusamus corrupti voluptatem
N/A,N/A,voluptatem quisquam pariatur voluptatum qui quaerat et minus ea aliquam ullam dolorem consequatur ratione at ad nemo aperiam excepturi deleniti qui numquam quis hic nostrum tempora quidem
N/A,N/A,esse vel reiciendis nobis inventore vero est fugit inventore ea quo consequatur aut autem deserunt ratione et repellendus nihil quam quidem iure est nihil mollitia
N/A,N/A,perferendis veritatis saepe voluptatem eum voluptas quis sed occaecati nostrum fugit animi omnis ratione molestias
N/A,N/A,ut nisi sunt perspiciatis qui doloribus quas velit molestiae atque corrupti corporis voluptatem vel ratione aperiam tempore est eos quia a voluptas
N/A,N/A,libero atque accusamus blanditiis minima eveniet corporis est aliquid dolores asperiores neque quibusdam quaerat error esse non qui et adipisci magni illo hic qui qui dignissimos earum
N/A,N/A,corrupti ut et eveniet culpa veritatis eos sequi fugiat commodi consequuntur ipsa totam voluptatem perferendis ducimus aut exercitationem magni eos mollitia quia
N/A,N/A,natus iure velit impedit sed officiis sint molestiae non beatae illo consequatur minima sed ratione est tenetur
N/A,N/A,sit delectus recusandae qui et cupiditate sed ipsum culpa et fugiat ab illo dignissimos quo est repellat dolorum neque voluptates sed sapiente ab aut rerum enim sint voluptatum
N/A,N/A,et nisi fugit totam maiores voluptatibus quis ipsa sunt debitis assumenda ullam non quasi numquam ut dolores modi recusandae ut molestias magni est voluptas quibusdam corporis eius
N/A,N/A,et a et perspiciatis autem expedita maiores dignissimos labore minus molestiae enim et ipsam ea et perspiciatis veritatis debitis maxime
N/A,N/A,modi est et eveniet facilis explicabo voluptatem saepe quo et sint quas quia corporis pariatur voluptatibus est iste fugiat delectus animi rerum doloribus est enim
N/A,N/A,aut aut sit cupiditate maxime praesentium occaecati cumque vero sint sit aliquam porro quo consequuntur ut numquam qui maxime voluptas est consequatur ullam tenetur commodi qui consectetur distinctio eligendi atque
N/A,N/A,dicta in quam tenetur sed molestiae a sit est aut quia autem aut nam voluptatem reiciendis corporis voluptatem sapiente est id quia explicabo enim tempora asperiores
N/A,N/A,totam ad quia non vero dolor laudantium sed temporibus quia aperiam corrupti sint accusantium eligendi aliquam rerum voluptatem delectus numquam nihil soluta qui sequi nisi voluptatum eaque voluptas animi ipsam
N/A,N/A,suscipit quidem fugiat consequatur quo sequi nesciunt aliquam ratione possimus voluptatem sit quia repellendus libero excepturi ut temporibus
N/A,N/A,provident illo quis dolor distinctio laborum eius enim suscipit quia error enim eos consequuntur est incidunt adipisci beatae tenetur excepturi in labore commodi fugiat omnis in et at nam accusamus et
N/A,N/A,in consequatur corporis qui a et magni eum illum corrupti veniam debitis ab iure harum enim ut assumenda cum adipisci veritatis et veniam rem eius expedita quos corrupti incidunt
N/A,N/A,nam voluptatem ex aut voluptatem mollitia sit sapiente qui hic ut qui natus in iste et magnam dolores et fugit ea sint ut minima quas eum nobis at reprehenderit
N/A,N/A,veniam non culpa aut voluptas rem eum officiis mollitia placeat eos cum consequatur eos commodi dolorem animi maiores qui
N/A,N/A,consequatur harum est omnis qui recusandae qui voluptatem et distinctio sint eaque dolores quo dolorem asperiores aperiam non quis asperiores aut praesentium
N/A,N/A,molestias debitis magni illo sint officiis ut quia sed tenetur dolorem soluta voluptatem fugiat voluptas molestiae magnam fuga similique enim illum voluptas aspernatur officia
N/A,N/A,iure vitae accusamus tenetur autem ipsa deleniti sunt laudantium ut beatae repellendus non eos ut consequuntur repudiandae ducimus enim reiciendis rem explicabo magni dolore
N/A,N/A,enim velit consequatur excepturi corporis voluptatem nostrum nesciunt alias perspiciatis corporis neque at eius porro sapiente ratione maiores natus facere molestiae vel explicabo voluptas unde
N/A,N/A,et vitae consectetur ut voluptatem et et eveniet sit incidunt tenetur voluptatem provident occaecati exercitationem neque placeat
N/A,N/A,animi est eveniet officiis qui aperiam dolore occaecati enim aut reiciendis animi ad sint labore blanditiis adipisci voluptatibus eius error omnis rerum facere architecto occaecati rerum
N/A,N/A,cum neque recusandae occaecati aliquam reprehenderit ullam saepe veniam quasi ea provident tenetur architecto ad cupiditate molestiae mollitia molestias debitis eveniet doloremque voluptatem aut dolore consequatur nihil facere et
N/A,N/A,voluptas cum eum minima rem dolorem et nemo repellendus voluptatem sit repudiandae nulla qui recusandae nobis blanditiis perspiciatis dolor ipsam reprehenderit odio
N/A,N/A,voluptate libero corrupti facere totam eaque consequatur nemo enim aliquid exercitationem nulla dignissimos illo est amet non iure amet sed dolore non ipsam magni
N/A,N/A,ducimus ut ut fugiat nesciunt labore deleniti non et aut voluptatum quidem consectetur incidunt voluptas accusantium quo fuga eaque quisquam et et sapiente aut
N/A,N/A,rerum laborum voluptas ipsa enim praesentium quisquam aliquid perspiciatis eveniet id est est facilis atque aut facere provident reiciendis libero atque est
N/A,N/A,ducimus hic ea velit dolorum soluta voluptas similique rerum dolorum sint maxime et vel voluptatum nesciunt et id consequatur earum sed
N/A,N/A,labore necessitatibus et eum quas id ut doloribus aspernatur nostrum sapiente quo aut quia eos rerum voluptatem numquam minima soluta velit recusandae ut
N/A,N/A,reiciendis consequatur sunt atque quisquam ut sed iure consequatur laboriosam dicta odio quas cumque iure blanditiis ad sed ullam dignissimos sunt et exercitationem saepe
N/A,N/A,in laborum et distinctio nobis maxime maxime id commodi eaque enim amet qui autem debitis et porro eum dicta sapiente iusto nulla sunt voluptate excepturi sint dolorem voluptatem quae explicabo id
N/A,N/A,excepturi quos omnis aliquam voluptatem iste sit unde ab quam ipsa delectus culpa rerum cum delectus impedit ut qui modi asperiores qui sapiente quia facilis in iure
N/A,N/A,ab voluptatem nobis unde doloribus aut fugiat consequuntur laboriosam minima inventore sint quis delectus hic et enim sit optio consequuntur
N/A,N/A,debitis ut maiores ut harum sed voluptas quae amet eligendi quo quidem odit atque quisquam animi ut autem est corporis et sed tempora facere corrupti magnam
N/A,N/A,voluptas minus fugiat vel est quos soluta et veniam quia incidunt unde ut laborum odio in eligendi distinctio odit repellat nesciunt consequatur blanditiis cupiditate consequatur at et
N/A,N/A,quam et et harum placeat minus neque quae magni inventore saepe deleniti quisquam suscipit dolorum error aliquid dolores dignissimos dolorem autem natus iste molestiae est id impedit
N/A,N/A,voluptatem minus asperiores quasi perspiciatis et aut blanditiis illo deserunt molestiae ab aperiam ex minima sed omnis at et repellat aut incidunt
N/A,N/A,ex eum at culpa quam aliquam cupiditate et id dolorem sint quasi et quos et omnis et qui minus est quisquam non qui rerum quas molestiae tempore veniam
