Name,Title,Body
Leanne Graham,sunt aut facere repellat provident occaecati excepturi optio reprehenderit,laudantium enim quasi est quidem magnam voluptate ipsam eos tempora quo necessitatibus dolor quam autem quasi reiciendis et nam sapiente accusantium
Ervin Howell,qui est esse,est natus enim nihil est dolore omnis voluptatem numquam et omnis occaecati quod ullam at voluptatem error expedita pariatur nihil sint nostrum voluptatem reiciendis et
Clementine Bauch,ea molestias quasi exercitationem repellat qui ipsa sit aut,quia molestiae reprehenderit quasi aspernatur aut expedita occaecati aliquam eveniet laudantium omnis quibusdam delectus saepe quia accusamus maiores nam est cum et ducimus et vero voluptates excepturi deleniti ratione
Patricia Lebsack,eum et est occaecati,non et atque occaecati deserunt quas accusantium unde odit nobis qui voluptatem quia voluptas consequuntur itaque dolor et qui rerum deleniti ut occaecati
Chelsey Dietrich,nesciunt quas odio,harum non quasi et ratione tempore iure ex voluptates in ratione harum architecto fugit inventore cupiditate voluptates magni quo et
Mrs. Dennis Schulist,dolorem eum magni eos aperiam quia,doloribus at sed quis culpa deserunt consectetur qui praesentium accusamus fugiat dicta voluptatem rerum ut voluptate autem voluptatem repellendus aspernatur dolorem in
Kurtis Weissnat,magnam facilis autem,maiores sed dolores similique labore et inventore et quasi temporibus esse sunt id et eos voluptatem aliquam aliquid ratione corporis molestiae mollitia quia et magnam dolor
Nicholas Runolfsdottir V,dolorem dolore est ipsam,ut voluptatem corrupti velit ad voluptatem maiores et nisi velit vero accusamus maiores voluptates quia aliquid ullam eaque
Glenna Reichert,nesciunt iure omnis dolorem tempora et accusantium,sapiente assumenda molestiae atque adipisci laborum distinctio aperiam et ab ut omnis et occaecati aspernatur odit sit rem expedita quas enim ipsam minus
Clementina DuBuque,optio molestias id quia eum,voluptate iusto quis nobis reprehenderit ipsum amet nulla quia quas dolores velit et non aut quia necessitatibus nostrum quaerat nulla et accusamus nisi facilis
N/A,et ea vero quia laudantium autem,ut dolorum nostrum id quia aut est fuga est inventore vel eligendi explicabo quis consectetur aut occaecati repellat id natus quo est ut blanditiis quia ut vel ut maiores ea
N/A,in quibusdam tempore odit est dolorem,expedita maiores dignissimos facilis ipsum est rem est fugit velit sequi eum odio dolores dolor totam occaecati ratione eius rem velit
N/A,dolorum ut in voluptas mollitia et saepe quo animi,fuga eos qui dolor rerum inventore corporis exercitationem corporis cupiditate et deserunt recusandae est sed quis culpa eum maiores corporis et
N/A,voluptatem eligendi optio,vel quae voluptas qui exercitationem voluptatibus unde sed minima et qui ipsam aspernatur expedita magnam laudantium et et quaerat ut qui dolorum
N/A,eveniet quod temporibus,nihil ut voluptates blanditiis autem odio dicta rerum quisquam saepe et est sunt quasi nemo laudantium deserunt molestias tempora quo quia
N/A,sint suscipit perspiciatis velit dolorum rerum ipsa laboriosam odio,iste ut laborum aliquid velit facere itaque quo ut soluta dicta voluptate error tempore aut et sequi reiciendis dignissimos expedita consequuntur libero sed fugiat facilis
N/A,fugit voluptas sed molestias voluptatem provident,consequatur necessitatibus totam sed sit dolorum recusandae quae odio excepturi voluptatum harum voluptas quisquam sit ad eveniet delectus doloribus odio qui non labore
N/A,voluptate et itaque vero tempora molestiae,veritatis voluptates necessitatibus maiores corrupti neque et exercitationem amet sit et ullam velit sit magnam laborum magni ut molestias
N/A,adipisci placeat illum aut reiciendis qui,doloribus est illo sed minima aperiam ut dignissimos accusantium tempore atque et aut molestiae magni ut accusamus voluptatem quos ut voluptates quisquam porro sed architecto ut
N/A,doloribus ad provident suscipit at,qui harum consequatur fugiat et eligendi perferendis at molestiae commodi ducimus doloremque asperiores numquam qui ut sit dignissimos reprehenderit tempore
N/A,asperiores ea ipsam voluptatibus modi minima quia sint,deleniti aut sed molestias explicabo commodi odio ratione nesciunt voluptate doloremque est nam autem error delectus
N/A,dolor sint quo a velit explicabo quia nam,qui ipsa animi nostrum praesentium voluptatibus odit qui non impedit cum qui nostrum aliquid fuga explicabo voluptatem fugit earum voluptas exercitationem temporibus dignissimos distinctio esse inventore reprehenderit quidem ut incidunt nihil necessitatibus rerum
N/A,maxime id vitae nihil numquam,voluptates provident repellendus iusto perspiciatis ex fugiat ut ut dolor nam aliquid et expedita voluptate sunt vitae illo rerum in quos vel eligendi enim quae fugiat est
N/A,autem hic labore sunt dolores incidunt,repudiandae repellat quia sequi est dolore explicabo nihil et et sit et et praesentium iste atque asperiores tenetur
N/A,rem alias distinctio quo quis,sunt aut quae laboriosam sit ut impedit adipisci harum laborum totam deleniti voluptas odit rem ea non iure distinctio ut velit doloribus et non ex
N/A,est et quae odit qui non,incidunt sapiente eaque dolor eos ad est molestias quas sit et nihil exercitationem at cumque ullam nihil magnam et
N/A,quasi id et eos tenetur aut quo autem,nisi vel quas ut laborum ratione rerum magni eum unde et voluptatem saepe voluptas corporis modi amet ipsam eos saepe porro
N/A,delectus ullam et corporis nulla voluptas sequi,voluptatem repellendus quo alias at laudantium mollitia quidem esse temporibus consequuntur vitae rerum illum id corporis sit id
N/A,iusto eius quod necessitatibus culpa ea,tempora voluptatem est magnam distinctio autem est dolorem et ipsa molestiae odit rerum itaque corporis nihil nam eaque rerum error
N/A,a quo magni similique perferendis,consequuntur quia voluptate assumenda et autem voluptatem reiciendis ipsum animi est provident earum aperiam sapiente ad vitae iste accusantium aperiam eius qui dolore voluptatem et
N/A,ullam ut quidem id aut vel consequuntur,quia incidunt ut aliquid est ut rerum deleniti iure est ipsum quia ea sint et voluptatem quaerat eaque repudiandae eveniet aut
N/A,doloremque illum aliquid sunt,nihil ea itaque libero illo officiis quo quo dicta inventore consequatur voluptas voluptatem corporis sed necessitatibus velit tempore rerum velit et temporibus
N/A,qui explicabo molestiae dolorem,fugit harum quae vero libero unde tempore soluta eaque culpa sequi quibusdam nulla id et et necessitatibus
N/A,magnam ut rerum iure,omnis temporibus quasi ab omnis facilis et omnis illum quae quasi aut minus iure ex rem ut reprehenderit in non fugit
N/A,id nihil consequatur molestias animi provident,dolor mollitia quidem facere et vel est ut ut repudiandae est quidem dolorem sed atque rem quia aut adipisci sunt
N/A,fuga nam accusamus voluptas reiciendis itaque,aut vero est dolor non aut excepturi dignissimos illo nisi aut quas aut magni quia nostrum provident magnam quas modi maxime voluptatem et molestiae
N/A,provident vel ut sit ratione est,qui rem amet aut cumque maiores earum ut quia sit nam esse qui iusto aspernatur quis voluptas dolorem distinctio ex temporibus rem
N/A,explicabo et eos deleniti nostrum ab id repellendus,unde voluptatem qui dicta vel ad aut eos error consequatur voluptatem adipisci doloribus qui est sit aut velit aut et ea ratione eveniet iure fuga
N/A,eos dolorem iste accusantium est eaque quam,atque consequatur dolorem sunt adipisci autem et voluptatibus et quae necessitatibus rerum eaque aperiam nostrum nemo eligendi sed et beatae et inventore
N/A,enim quo cumque,quod minus alias quos perferendis labore molestias quae ut ut corporis deserunt vitae et quaerat ut et ullam unde asperiores cum voluptatem cumque
N/A,non est facere,facere repudiandae vitae ea aut sed quo ut et facere nihil ut voluptates in saepe cupiditate accusantium numquam dolores inventore sint mollitia provident
N/A,commodi ullam sint et excepturi error explicabo praesentium voluptas,aut culpa quaerat veritatis eos debitis aut repellat eius explicabo et officiis quo sint at magni ratione et iure incidunt quo sequi quia dolorum beatae qui
N/A,eligendi iste nostrum consequuntur adipisci praesentium sit beatae perferendis,voluptatem ut possimus laborum quae ut commodi delectus in et consequatur in voluptas beatae molestiae est rerum laborum et et velit sint ipsum dolorem
N/A,optio dolor molestias sit,qui sunt commodi sint vel optio vitae quis qui non distinctio id quasi modi dicta eos nihil sit inventore est numquam officiis
N/A,ut numquam possimus omnis eius suscipit laudantium iure,ipsum odio harum voluptatem sunt cumque et dolores nihil laboriosam neque commodi qui est quos numquam voluptatum corporis quo in vitae similique cumque tempore
N/A,aut quo modi neque nostrum ducimus,exercitationem et id quae cum omnis voluptatibus accusantium et quidem ut ipsam sint doloremque illo ex atque necessitatibus sed
N/A,quibusdam cumque rem aut deserunt,occaecati laudantium ratione non cumque earum quod non enim soluta nisi velit similique voluptatibus esse laudantium consequatur voluptatem rem eaque voluptatem aut ut et sit quam
N/A,ut voluptatem illum ea doloribus itaque eos,illum et alias quidem magni voluptatum ab soluta ea qui saepe corrupti hic et cum repellat esse est sint vel veritatis officia consequuntur cum
N/A,laborum non sunt aut ut assumenda perspiciatis voluptas,id est iure occaecati quam similique enim ab repudiandae non illum expedita quam excepturi soluta qui placeat perspiciatis optio maiores non doloremque aut iusto sapiente
N/A,repellendus qui recusandae incidunt voluptates tenetur qui omnis exercitationem,eum accusamus aut delectus architecto blanditiis quia sunt rerum harum sit quos quia aspernatur vel corrupti inventore animi dicta vel corporis
N/A,soluta aliquam aperiam consequatur illo quis voluptas,perferendis omnis esse voluptate sit mollitia sed perferendis nemo nostrum qui vel quis nisi doloribus animi odio id quas
N/A,qui enim et consequuntur quia animi quis voluptate quibusdam,et enim voluptatem totam laudantium impedit nam labore repellendus enim earum aut consectetur mollitia fugit qui repellat expedita sunt aut fugiat vel illo quos aspernatur ducimus
N/A,ut quo aut ducimus alias,a at tempore molestiae odit qui dolores molestias dolorem et laboriosam repudiandae placeat quisquam autem aperiam consectetur maiores laboriosam nostrum
N/A,sit asperiores ipsam eveniet odio non quia,et ipsa rem ullam cum pariatur similique quia cum ipsam est sed aut inventore provident sequi commodi enim inventore assumenda aut aut tempora possimus soluta quia consequatur modi illo
N/A,sit vel voluptatem et non libero,perferendis eaque labore laudantium ut molestiae soluta et vero odio non corrupti error pariatur consectetur et enim nam quia voluptatum non mollitia culpa facere voluptas suscipit veniam
N/A,qui et at rerum necessitatibus,cum esse odio nihil reiciendis illum quaerat est facere quia occaecati sit totam fugiat in beatae ut occaecati unde vitae nihil quidem consequatur
N/A,sed ab est est,dolorem facere itaque fuga odit autem perferendis quisquam quis corrupti eius dicta repudiandae error esse itaque aut corrupti sint consequatur aliquid
N/A,voluptatum itaque dolores nisi et quasi,veritatis qui nihil quia reprehenderit non ullam ea iusto consectetur nam voluptas ut temporibus tempore provident error eos et nisi et voluptate
N/A,qui commodi dolor at maiores et quis id accusantium,cumque molestiae officia aut fugiat nemo autem vero alias atque sed qui ratione quia repellat vel earum ea laudantium mollitia
N/A,consequatur placeat omnis quisquam quia reprehenderit fugit veritatis facere,error eum quia voluptates alias repudiandae accusantium veritatis maiores assumenda quod impedit animi tempore veritatis animi et et officiis labore impedit blanditiis repudiandae
N/A,voluptatem doloribus consectetur est ut ducimus,deserunt cumque laudantium et et odit quia sint quia quidem quibusdam debitis fuga in tempora deleniti impedit consequatur veniam reiciendis autem porro minima
N/A,beatae enim quia vel,tempore dolorum corrupti facilis praesentium sunt iste recusandae unde quisquam similique alias consequuntur voluptates velit
N/A,voluptas blanditiis repellendus animi ducimus error sapiente et suscipit,aut eligendi et molestiae voluptatum tempora officia nihil sit voluptatem aut deleniti quaerat consequatur eaque sapiente tempore commodi tenetur rerum qui quo
N/A,et fugit quas eum in in aperiam quod,sed illum quis ut aut culpa labore aspernatur illo dolorem quia vitae ut aut quo repellendus est omnis esse at est debitis
N/A,consequatur id enim sunt et et,qui debitis vitae ratione tempora impedit aperiam porro molestiae placeat vero laboriosam recusandae praesentium consequatur facere et itaque quidem eveniet magnam natus distinctio sapiente
N/A,repudiandae ea animi iusto,necessitatibus libero occaecati vero inventore iste assumenda veritatis asperiores non sit et quia omnis facere nemo explicabo odit quo nobis porro
N/A,aliquid eos sed fuga est maxime repellendus,nulla quo itaque beatae ad officiis animi aut exercitationem voluptatum dolorem doloremque ducimus in recusandae officia consequuntur quas aspernatur dolores est esse dolores sit illo laboriosam quaerat
N/A,odio quis facere architecto reiciendis optio,sed magni accusantium numquam quidem omnis et voluptatem beatae quos fugit libero vel ipsa et nihil recusandae ea iste nemo qui optio sit enim ut nostrum odit
N/A,fugiat quod pariatur odit minima,omnis dolor autem qui est natus autem animi nemo voluptatum aut natus accusantium iure inventore sunt ea tenetur commodi suscipit facere architecto consequatur dolorem nihil veritatis consequuntur corporis
N/A,voluptatem laborum magni,omnis aliquam praesentium ad voluptatem harum aperiam dolor autem hic asperiores quisquam ipsa necessitatibus suscipit praesentium rem deserunt et facere repellendus aut sed fugit qui est
N/A,et iusto veniam et illum aut fuga,mollitia magnam et ipsum consequatur est expedita aut rem ut ex doloremque est vitae est cumque velit recusandae numquam libero dolor fuga fugit a
N/A,sint hic doloribus consequatur eos non id,quisquam voluptas ut pariatur eos amet non reprehenderit voluptates numquam in est voluptatem dicta ipsa qui esse enim
N/A,consequuntur deleniti eos quia temporibus ab aliquid at,nam qui possimus deserunt inventore dignissimos nihil rerum ut consequatur vel architecto tenetur recusandae voluptate numquam dignissimos aliquid ut reprehenderit voluptatibus
N/A,enim unde ratione doloribus quas enim ut sit sapiente,non accusamus eum aut et est accusantium animi nesciunt distinctio ea quas quisquam sit ut voluptatem modi natus sint facilis est qui molestias recusandae nemo
N/A,dignissimos eum dolor ut enim et delectus in,natus numquam enim asperiores doloremque ullam et est molestias doloribus cupiditate labore vitae aut voluptatem itaque quos quo consectetur nihil illum veniam nostrum voluptatum repudiandae ut
N/A,doloremque officiis ad et non perferendis,sunt qui consequatur similique recusandae repellendus voluptates eos et vero nostrum fugit magnam aliquam reprehenderit nobis voluptatem eos consectetur possimus et perferendis qui ea fugiat sit doloremque
N/A,necessitatibus quasi exercitationem odio,eos ullam dolorem impedit labore mollitia rerum non dolores molestiae dignissimos qui maxime sed voluptate consequatur doloremque praesentium magnam odio iste quae totam aut
N/A,quam voluptatibus rerum veritatis,qui adipisci eveniet excepturi iusto magni et enim ducimus asperiores blanditiis nemo commodi nihil ex enim rerum vel nobis nostrum et non
N/A,pariatur consequatur quia magnam autem omnis non amet,et inventore sapiente sed sunt similique fugiat officia velit doloremque illo eligendi quas sed rerum in quidem perferendis facere molestias dolore dolor voluptas nam vel quia
N/A,labore in ex et explicabo corporis aut quas,dignissimos itaque ab et tempore odio omnis voluptatem itaque perferendis rem repellendus tenetur nesciunt velit qui cupiditate recusandae quis debitis dolores aliquam nam
N/A,tempora rem veritatis voluptas quo dolores vero,illum et voluptatem quis repellendus quidem repellat reprehenderit voluptas consequatur mollitia praesentium nisi quo quod et occaecati repellendus illo eius harum explicabo doloribus officia
N/A,laudantium voluptate suscipit sunt enim enim,officiis dolorem voluptas aliquid eveniet tempora qui ea temporibus labore accusamus sint ut sunt necessitatibus voluptatum animi cumque at reiciendis voluptatem iure aliquid et qui dolores et
N/A,odit et voluptates doloribus alias odio et,et consequatur voluptates magnam fugit sunt repellendus nihil earum officiis aut cupiditate et distinctio laboriosam molestiae sunt dolor explicabo recusandae
N/A,optio ipsam molestias necessitatibus occaecati facilis veritatis dolores aut,ratione ut magni voluptas explicabo natus quia consequatur nostrum aut omnis enim in qui illum aut atque laboriosam aliquid blanditiis quisquam et laborum
N/A,dolore veritatis porro provident adipisci blanditiis et sunt,quisquam incidunt dolores sint qui doloribus provident vel cupiditate deleniti alias voluptatem placeat ad ut dolorem illum unde iure quis libero neque ea et distinctio id
N/A,placeat quia et porro iste,eum culpa debitis sint eaque quia magni laudantium qui neque voluptas voluptatem qui molestiae vel earum est ratione excepturi sit aut explicabo et repudiandae ut perspiciatis
N/A,nostrum quis quasi placeat,assumenda corporis architecto repudiandae omnis qui et odit perferendis velit enim et quia reiciendis sint quia voluptas quam deserunt facilis harum eligendi
N/A,sapiente omnis fugit eos,laudantium corrupti atque exercitationem quae enim et veniam dicta autem perspiciatis sit dolores minima consectetur tenetur iste facere amet est neque
N/A,sint soluta et vel magnam aut ut sed qui,quibusdam rerum quia nostrum culpa culpa est natus impedit quo rem voluptate quos rerum culpa aut ut consectetur sunt esse laudantium voluptatibus cupiditate rerum
N/A,ad iusto omnis odit dolor voluptatibus,vitae cupiditate excepturi eum veniam laudantium aspernatur blanditiis aspernatur quia ut assumenda et magni enim magnam in voluptate tempora non qui voluptatem reprehenderit porro qui voluptatibus
N/A,aut amet sed,qui nisi at maxime deleniti quo ex quas tenetur nam deleniti aut asperiores deserunt cum ex eaque alias sit et veniam ab consequatur molestiae
N/A,ratione ex tenetur perferendis,nihil necessitatibus omnis asperiores nobis praesentium quia ab debitis quo deleniti aut sequi commodi ut perspiciatis quod est magnam aliquam modi eum quos aliquid ea est
N/A,beatae soluta recusandae,ut quis et id repellat labore nobis itaque quae saepe est ullam aut dolor id ut quis sunt iure voluptates expedita voluptas doloribus modi saepe autem
N/A,qui qui voluptates illo iste minima,reiciendis delectus nulla quae voluptas nihil provident quia ab corporis nesciunt blanditiis quibusdam et unde et magni eligendi aperiam corrupti perspiciatis quasi neque iure voluptatibus mollitia
N/A,id minus libero illum nam ad officiis,at ut tenetur rem ut fuga quis ea magnam alias aut tempore fugiat laboriosam porro quia iure qui architecto est enim
N/A,quaerat velit veniam amet cupiditate aut numquam ut sequi,eum itaque quam laboriosam sequi ullam quos nobis omnis dignissimos nam dolores facere id suscipit aliquid culpa rerum quis
N/A,quas fugiat ut perspiciatis vero provident,est ducimus voluptate saepe iusto repudiandae recusandae et sint fugit voluptas eum itaque odit ab eos voluptas molestiae necessitatibus earum possimus voluptatem quibusdam aut illo beatae qui delectus aut officia veritatis
N/A,laboriosam dolor voluptates,ex et expedita cum voluptatem voluptatem ab expedita quis nihil esse quo nihil perferendis dolores velit ut culpa aut dolor maxime necessitatibus voluptatem
N/A,temporibus sit alias delectus eligendi possimus magni,aut quam consequatur sit et repellat maiores laborum similique voluptatem necessitatibus nihil et debitis nemo occaecati cupiditate modi dolorum quia aut
N/A,at nam consequatur ea labore ea harum,architecto dolorem ab explicabo et provident et et eos illo omnis mollitia ex aliquam atque ut ipsum nulla nihil quis voluptas aut debitis facilis
N/A,N/A,ut aut maxime officia sed aliquam et magni autem veniam repudiandae nostrum odio enim eum optio aut omnis illo quasi quibusdam inventore explicabo reprehenderit dolor saepe possimus molestiae
N/A,N/A,aut dolorem quos ut non aliquam unde iure minima quod ullam qui fugiat molestiae tempora voluptate vel labore saepe animi et vitae numquam ipsa
N/A,N/A,totam eum fugiat repellendus quae beatae explicabo excepturi iusto et repellat alias iure voluptates consequatur sequi minus sed maxime unde
N/A,N/A,qui aperiam labore animi magnam odit est ut autem eaque ea magni quas voluptatem doloribus vel voluptatem nostrum ut debitis enim quaerat ut esse eveniet aut
N/A,N/A,ut rerum illum error at inventore ab nobis molestiae ipsa architecto temporibus non aliquam aspernatur omnis quidem aliquid consequatur non et expedita cumque voluptates ipsam quia blanditiis libero itaque sed iusto at
N/A,N/A,dolores debitis voluptatem ab hic magnam alias qui est sunt et porro velit et repellendus occaecati est sequi quia odio deleniti illum
N/A,N/A,eveniet fugit qui porro eaque dolores eos adipisci dolores ut fugit perferendis pariatur numquam et repellat occaecati atque ipsum neque
N/A,N/A,at a vel sequi nostrum harum nam nihil cumque aut in dolore rerum ipsa hic ratione rerum cum ratione provident labore ad quisquam repellendus a
N/A,N/A,aliquid qui dolorem deserunt aperiam natus corporis eligendi neque at et sunt aut qui illum repellat qui excepturi laborum facilis aut omnis consequatur et aut optio ipsa nisi enim
N/A,N/A,cum sequi in eligendi id eaque dolores accusamus dolorem eum est voluptatem quisquam tempore in voluptas enim voluptatem asperiores voluptatibus eius quo quos quasi voluptas earum ut necessitatibus
N/A,N/A,ullam autem et accusantium quod sequi similique soluta explicabo ipsa eius ratione quisquam sed et excepturi occaecati pariatur molestiae ut reiciendis eum voluptatem sed
N/A,N/A,ut tempora deleniti quo molestiae eveniet provident earum occaecati est nesciunt ut pariatur ipsa voluptas voluptatem aperiam qui deleniti quibusdam voluptas molestiae facilis id iusto similique tempora aut qui
N/A,N/A,voluptatem sint quia modi accusantium alias recusandae rerum voluptatem aut sit et ut magnam voluptas rerum odio quo labore voluptatem facere consequuntur ut sit voluptatum hic distinctio
N/A,N/A,nihil labore qui quis dolor eveniet iste numquam porro velit incidunt laboriosam asperiores aliquam facilis in et voluptas eveniet quasi
N/A,N/A,laudantium tempore aut maiores laborum fugit qui suscipit hic sint officiis corrupti officiis eum optio cumque fuga sed voluptatibus similique sit consequuntur rerum commodi
N/A,N/A,quia voluptas qui assumenda nesciunt harum iusto est corrupti aperiam ut aut unde maxime consequatur eligendi veniam modi id sint rem labore saepe minus
N/A,N/A,doloribus esse necessitatibus qui eos et ut est saepe sed rerum tempore est ut quisquam et eligendi accusantium commodi non doloribus
N/A,N/A,repudiandae aliquam maxime cupiditate consequatur id quas error repellendus totam officia dolorem beatae natus cum exercitationem asperiores dolor ea
N/A,N/A,et omnis consequatur ut in suscipit et voluptatem animi at ut dolores quos aut numquam esse praesentium aut placeat nam
N/A,N/A,iusto sint recusandae placeat atque perferendis sit corporis molestiae rem dolor eius id delectus et qui sed dolorem reiciendis error ullam corporis delectus explicabo mollitia odit laborum sed itaque deserunt rem dolorem
N/A,N/A,soluta mollitia impedit cumque nostrum tempore aut placeat repellat enim adipisci dolores aut ut ratione laboriosam necessitatibus vel et blanditiis est iste sapiente qui atque repellendus alias earum consequuntur quia quasi quia
N/A,N/A,doloribus veritatis a et quis corrupti incidunt est harum maiores impedit et beatae qui velit et aut porro sed dignissimos deserunt deleniti et eveniet voluptas ipsa pariatur rem ducimus
N/A,N/A,nostrum perspiciatis doloribus explicabo soluta id libero illo iste et ab expedita error aliquam eum sint ipsum modi possimus et
N/A,N/A,ut ut eius qui explicabo quis iste autem nulla beatae tenetur enim assumenda explicabo consequatur harum exercitationem velit itaque consectetur et possimus
N/A,N/A,aut voluptas dolore autem reprehenderit expedita et nihil pariatur ea animi quo ullam a ea officiis corporis eius voluptatum cum mollitia dolore quaerat accusamus
N/A,N/A,est qui ut tempore temporibus pariatur provident qui consequuntur laboriosam porro dignissimos quos debitis id laborum et totam aut eius sequi dolor maiores amet rerum voluptatibus quod ratione quos labore fuga sit
N/A,N/A,omnis consequatur dignissimos iure rerum odio culpa laudantium quia voluptas enim est nisi doloremque consequatur autem officiis necessitatibus beatae et et itaque animi dolor praesentium
N/A,N/A,exercitationem eius aut ullam vero impedit similique maiores ea et in culpa possimus omnis eos labore autem quam repellendus dolores deserunt voluptatem non ullam eos accusamus
N/A,N/A,fugit minima voluptatem est aut sed explicabo harum dolores at qui eaque magni velit ut et nam et ut sunt excepturi repellat non commodi
N/A,N/A,dicta sit culpa molestiae quasi at voluptate eos dolorem perferendis accusamus rerum expedita ipsum quis qui quos est deserunt rerum fuga qui aliquam in consequatur aspernatur
N/A,N/A,rem magnam at voluptatem aspernatur et et nostrum rerum dignissimos eum quibusdam optio quod dolores et
N/A,N/A,ullam harum consequatur est rerum est magni tenetur aperiam et repudiandae et reprehenderit dolorum enim voluptas impedit eligendi quis necessitatibus in exercitationem voluptatem qui
