Name,Title,Body
N/A,N/A,sunt quis iure molestias qui ipsa commodi dolore a odio qui debitis earum unde ut omnis doloremque corrupti at repellendus earum eum
N/A,N/A,corrupti perspiciatis eligendi et omnis tempora nobis dolores hic dolorum vitae odit reiciendis sunt odit qui
N/A,N/A,sapiente nostrum dolorem odit a sed animi non architecto doloremque unde nam aut aut ut facilis et ut autem fugit minima culpa inventore non
N/A,N/A,cum natus qui dolorem dolorum nihil ut nam tempore modi nesciunt ipsum hic rem sunt possimus earum magnam similique aspernatur sed totam sed voluptatem iusto id iste qui
N/A,N/A,reiciendis maiores id voluptas sapiente deserunt itaque ut omnis sunt necessitatibus quibusdam dolorem voluptatem harum error
N/A,N/A,dolorem suscipit adipisci ad cum totam quia fugiat vel quia dolores molestiae eos omnis officia quidem quaerat alias vel distinctio vero provident et corporis a quia ut
N/A,N/A,facilis cumque nostrum dignissimos doloremque saepe quia adipisci sunt dicta dolorum quo esse culpa iste ut asperiores cum aperiam
N/A,N/A,velit ipsa fugiat sit qui vel nesciunt sapiente repudiandae perferendis nemo eos quos perspiciatis aperiam doloremque incidunt nostrum temporibus corrupti repudiandae vitae non corporis cupiditate suscipit quod sed numquam excepturi enim labore
N/A,N/A,et ullam id eligendi rem sit occaecati et delectus in nemo aut veritatis deserunt aspernatur dolor enim voluptas quos consequatur molestiae temporibus error
N/A,N/A,cumque voluptas quo eligendi sit nemo ut ut dolor et cupiditate aut et voluptatem quia aut maiores quas accusantium expedita quia beatae aut ad quis soluta id dolorum
N/A,N/A,est quasi maiores nisi reiciendis enim dolores minus facilis laudantium dignissimos reiciendis et facere occaecati dolores et possimus et vel et aut ipsa ad
N/A,N/A,voluptatem unde consequatur natus nostrum vel ut consequatur sequi doloremque omnis dolorem maxime eaque sunt excepturi fuga qui illum et accusamus
N/A,N/A,assumenda nihil et sed nulla tempora porro iste possimus aut sit officia cumque totam quis tenetur qui sequi delectus aut sunt
N/A,N/A,possimus necessitatibus quis et dicta omnis voluptatem ea est suscipit eum soluta in quia corrupti hic iusto consequatur est aut qui earum nisi officiis sed culpa
N/A,N/A,nihil aspernatur consequatur voluptatem facere sed fugiat ullam beatae accusamus et fuga maxime vero omnis necessitatibus quisquam ipsum consectetur incidunt repellat voluptas error quo et ab magnam quisquam
N/A,N/A,nemo corporis quidem eius aut dolores itaque rerum quo occaecati mollitia incidunt autem est saepe nulla nobis a id dolore facilis placeat molestias in fugiat aliquam excepturi
N/A,N/A,veniam est distinctio nihil quia eos sed distinctio hic ut sint ducimus debitis dolorem voluptatum assumenda eveniet ea perspiciatis
N/A,N/A,est non atque eligendi aspernatur quidem earum mollitia minima neque nam exercitationem provident eum maxime quo et ut illum sequi aut fuga repudiandae sapiente sed ea distinctio molestias illum consequatur libero quidem
N/A,N/A,quos eos sint voluptatibus similique iusto perferendis omnis voluptas earum nulla cumque dolorem consequatur officiis quis consequatur aspernatur nihil ullam et enim enim unde nihil labore non ducimus
N/A,N/A,itaque veritatis explicabo quis voluptatem mollitia soluta id non doloribus nobis fuga provident nesciunt saepe molestiae praesentium laboriosam
N/A,N/A,et cumque error pariatur quo doloribus corrupti voluptates ad voluptatem consequatur voluptas dolores pariatur at quas iste repellat et sed quasi ea maiores rerum aut earum
N/A,N/A,quod magni consectetur quod doloremque velit autem ipsam nisi praesentium ut laboriosam quod deleniti pariatur aliquam sint excepturi a consectetur quas eos
N/A,N/A,animi asperiores modi et tenetur vel magni id iusto aliquid ad nihil dolorem dolorum aut veritatis voluptates omnis cupiditate incidunt
N/A,N/A,dolorum voluptas laboriosam quisquam ab totam beatae et aut aliquid optio assumenda voluptas velit itaque quidem voluptatem tempore cupiditate in itaque sit molestiae minus dolores magni
N/A,N/A,voluptas quia quo ad ipsum voluptatum provident ut ipsam velit dignissimos aut assumenda ut officia laudantium quibusdam sed minima
N/A,N/A,et qui ad vero quis quisquam omnis fuga et vel nihil minima eligendi nostrum sed deserunt rem voluptates autem quia blanditiis cum sed
N/A,N/A,deserunt deleniti officiis architecto consequatur molestiae facere dolor voluptatem velit eos fuga dolores sit quia est a deleniti hic dolor quisquam repudiandae voluptas numquam voluptatem impedit
N/A,N/A,non reprehenderit aut sed quos est ad voluptatum est ut est dignissimos ut dolores consequuntur debitis aspernatur consequatur est porro nulla laboriosam repellendus et nesciunt est libero placeat
N/A,N/A,sunt totam blanditiis eum quos fugit et ab rerum nemo ut iusto architecto ut et eligendi iure placeat omnis
N/A,N/A,nulla impedit porro in sed voluptatem qui voluptas et enim beatae nobis et sit ipsam aut voluptatem voluptatibus blanditiis officia quod eos omnis earum dolorem
N/A,N/A,molestiae dolorem quae rem neque sapiente voluptatum nesciunt cum id rerum at blanditiis est accusantium est eos illo porro ad quod repellendus ad et labore fugit dolorum
N/A,N/A,beatae aut ut autem sit officia rerum nostrum provident ratione sed dicta omnis alias commodi rerum expedita non nobis sapiente consectetur odit unde quia voluptas in nihil consequatur doloremque ullam dolorem cum
N/A,N/A,sed praesentium ducimus minima autem corporis debitis aperiam eum sit pariatur impedit placeat illo odio odit accusantium expedita quo rerum magnam
N/A,N/A,nam quas eaque unde dolor blanditiis cumque eaque omnis qui rerum modi sint quae numquam exercitationem atque aut praesentium ipsa sit neque qui sint aut
N/A,N/A,molestiae voluptatem qui id facere nostrum quasi asperiores rerum quisquam est repellendus deleniti eos aut sed nemo non
N/A,N/A,cupiditate optio in quidem adipisci sit dolor id et tenetur quo sit odit aperiam illum optio magnam qui molestiae eligendi harum optio dolores dolor quaerat nostrum
N/A,N/A,unde non aliquid magni accusantium architecto et rerum autem eos explicabo et odio facilis sed rerum ex esse beatae quia
N/A,N/A,amet id deserunt ipsam cupiditate distinctio nulla voluptatem cum possimus voluptate ipsum quidem laudantium quos nihil
N/A,N/A,sed non beatae placeat qui libero nam eaque qui quia ut ad doloremque sequi unde quidem adipisci debitis autem velit architecto aperiam eos nihil enim dolores veritatis omnis ex
N/A,N/A,nemo ullam omnis sit labore perferendis et eveniet nostrum dignissimos expedita iusto occaecati quia sit quibusdam
N/A,N/A,asperiores hic fugiat aut et temporibus mollitia quo quam cumque numquam labore qui illum vel provident quod pariatur natus incidunt sunt error voluptatibus vel voluptas maiores est vero possimus
N/A,N/A,sit dolores consequatur qui voluptas sunt earum at natus alias excepturi dolores maiores pariatur at reiciendis dolor esse optio
N/A,N/A,culpa non ea perspiciatis exercitationem sed natus sit enim voluptatum ratione omnis consequuntur provident commodi omnis quae odio sit at tempora
N/A,N/A,quam culpa fugiat rerum impedit ratione vel ipsam rem commodi qui rem eum itaque officiis omnis ad
N/A,N/A,ut facilis sapiente quia repellat autem et aut delectus sint autem nulla debitis omnis consequuntur neque
N/A,N/A,sit maxime fugit sequi culpa optio consequatur voluptatem dolor expedita enim iure eum reprehenderit doloremque aspernatur modi voluptatem culpa nostrum quod atque rerum sint laboriosam et
N/A,N/A,non saepe ipsa velit sunt totam ipsum optio voluptatem nesciunt qui iste eum et deleniti ullam
N/A,N/A,recusandae temporibus nihil non alias consequatur libero voluptatem sed soluta accusamus a qui reiciendis officiis ad quia laborum libero et rerum voluptas sed ut et
N/A,N/A,dolor iure corrupti et eligendi nesciunt voluptatum autem consequatur in sapiente dolor voluptas dolores natus iusto qui et in perferendis
N/A,N/A,voluptatum voluptatem nisi consequatur et omnis nobis odio neque ab enim veniam sit qui aperiam odit voluptatem facere nesciunt esse nemo
N/A,N/A,tempora soluta voluptas deserunt non fugiat similique est natus enim eum error magni soluta dolores sit doloremque
N/A,N/A,odio saepe ad error minima itaque omnis fuga corrupti qui eaque cupiditate eum vitae laborum rerum ut reprehenderit architecto sit debitis magnam qui corrupti cum quidem commodi facere corporis
N/A,N/A,deleniti non et corrupti delectus ea cupiditate at nihil fuga rerum temporibus doloribus unde sed alias ducimus perspiciatis quia debitis fuga
N/A,N/A,asperiores eaque error sunt ut natus et omnis expedita error iste vitae sit alias voluptas voluptatibus quia iusto quia ea enim facere est quam ex
N/A,N/A,et enim necessitatibus velit autem magni voluptas at maxime error sunt nobis sit dolor beatae harum rerum tenetur facere pariatur et perferendis voluptas maiores nihil eaque
N/A,N/A,quam magni adipisci totam ut reprehenderit ut tempore non asperiores repellendus architecto aperiam dignissimos est aut reiciendis consectetur voluptate nihil culpa at molestiae labore qui ea
N/A,N/A,nostrum excepturi debitis cum architecto iusto laudantium odit aut dolor voluptatem consectetur nulla mollitia beatae autem quasi nemo repellendus ut ea et aut architecto odio cum quod optio
N/A,N/A,laudantium vero similique eum iure iste culpa praesentium molestias doloremque alias et at doloribus aperiam natus est illo quo ratione porro excepturi
N/A,N/A,sit vero aut voluptatem soluta corrupti dolor cum nulla ipsa accusamus aut suscipit ut dicta ut nemo ut et ut sit voluptas modi illum suscipit ea debitis aut ullam harum
N/A,N/A,dolore velit autem perferendis hic tenetur quo rerum impedit error sit eaque ut ad in expedita et nesciunt sit aspernatur repudiandae
N/A,N/A,laudantium consequatur sed adipisci a odit quia necessitatibus qui numquam expedita est accusantium nostrum occaecati perspiciatis molestiae nostrum atque
N/A,N/A,aut distinctio iusto autem sit libero deleniti est soluta non perferendis illo eveniet corrupti est sint quae sed sunt voluptatem
N/A,N/A,culpa voluptas quidem eos quis excepturi quasi corporis provident enim provident velit ex occaecati deleniti id aspernatur fugiat eligendi
N/A,N/A,eum laborum quidem omnis facere harum ducimus dolores quaerat corporis quidem aliquid quod aut aut at dolorum aspernatur reiciendis exercitationem quasi consectetur asperiores vero blanditiis dolor
N/A,N/A,fugit ut laborum provident quos provident voluptatibus quam non sed accusantium explicabo dolore quia distinctio voluptatibus et consequatur eos qui iure minus eaque praesentium
N/A,N/A,est veritatis mollitia atque quas et sint et dolor et ut beatae aut magni corporis dolores voluptatibus optio molestiae enim minus est reiciendis facere voluptate rem officia doloribus ut
N/A,N/A,veniam eos ab voluptatem in fugiat ipsam quis officiis non qui quia ut id voluptates et a molestiae commodi quam dolorem enim soluta impedit autem nulla
N/A,N/A,facere maxime alias aspernatur ab quibusdam necessitatibus ratione similique error enim sed minus et et provident minima voluptatibus
N/A,N/A,est officiis placeat id et iusto ut fugit numquam eos aut voluptas ad quia tempore qui quibusdam doloremque recusandae tempora qui
N/A,N/A,sequi expedita quibusdam enim ipsam beatae ad eum placeat perspiciatis quis in nulla porro voluptas quia esse et quibusdam
N/A,N/A,eum voluptates id autem sequi qui omnis commodi veniam et laudantium aut et molestias esse asperiores et quaerat pariatur non officia voluptatibus
N/A,N/A,voluptatibus pariatur illo autem quia aut ullam laudantium quod laborum officia dicta sit consequatur quis delectus vel omnis laboriosam laborum vero ipsa voluptas
N/A,N/A,voluptatem accusamus delectus natus quasi aliquid porro ab id ea aut consequatur dignissimos quod et aspernatur sapiente cum corrupti pariatur veritatis unde
N/A,N/A,nam iusto minus expedita numquam et id quis voluptatibus minima porro facilis dolores beatae aut sit aut quia suscipit
N/A,N/A,nulla quos harum commodi aperiam qui et dignissimos reiciendis ut quia est corrupti itaque laboriosam debitis suscipit
N/A,N/A,enim aut doloremque mollitia provident molestiae omnis esse excepturi officiis tempora sequi molestiae veniam voluptatem recusandae omnis temporibus et deleniti laborum sed ipsa molestiae eum aut
N/A,N/A,officiis qui eos voluptas laborum error sunt repellat quis nisi unde velit delectus eum molestias tempora quia ut aut consequatur cupiditate quis sint in eum voluptates
N/A,N/A,praesentium odit quos et tempora eum voluptatem non non aut eaque consectetur reprehenderit in qui eos nam nemo ea eos ea nesciunt consequatur et
N/A,N/A,odio temporibus est ut a aut commodi minima tempora eum et fuga omnis alias deleniti facere totam unde impedit voluptas et possimus consequatur necessitatibus qui velit
N/A,N/A,aut vero sint ut et voluptate sunt quod velit impedit quia cupiditate dicta magni ut eos blanditiis assumenda pariatur nemo est tempore velit
N/A,N/A,at non dolore molestiae autem rerum id cum facilis sit necessitatibus accusamus quia officiis sint ea sit natus rerum est nemo perspiciatis ea
N/A,N/A,nam nesciunt earum sequi dolorum et fuga sint quae architecto in et et ipsam veniam ad voluptas rerum animi illum temporibus enim rerum est
N/A,N/A,esse ab est deleniti dicta non inventore veritatis cupiditate eligendi sequi excepturi assumenda a harum sint aut eaque rerum molestias id excepturi quidem aut
N/A,N/A,minima quaerat voluptatibus iusto earum quia nihil et minus deleniti aspernatur voluptatibus tempore sit molestias architecto velit id debitis
N/A,N/A,aperiam rerum aut provident cupiditate laboriosam enim placeat aut explicabo voluptatum similique rerum eaque eligendi nobis occaecati perspiciatis sint ullam
N/A,N/A,rem qui est facilis qui voluptatem quis est veniam quam aspernatur dicta dolore id sapiente saepe consequatur enim qui impedit culpa ex qui voluptas dolor
N/A,N/A,est et dolores voluptas aut molestiae nam eos saepe expedita eum ea tempore sit iure eveniet iusto enim quos quo repellendus laudantium eum fugiat aut et
N/A,N/A,illum ea eum quia doloremque modi ducimus voluptatum eaque aperiam accusamus eos quia sed rerum aperiam sunt quo ea veritatis natus eos deserunt voluptas ea voluptate
N/A,N/A,rerum possimus asperiores non dolores maiores tenetur ab suscipit laudantium possimus ab iure distinctio assumenda iste adipisci optio est sed eligendi temporibus perferendis tempore soluta
N/A,N/A,cum officiis impedit neque a sed dolorum accusamus eaque repellat natus aut commodi sint fugit consequatur corporis voluptatum dolorum sequi perspiciatis ut facilis delectus pariatur consequatur at aut temporibus facere vitae
N/A,N/A,maiores perspiciatis quo alias doloremque illum iusto possimus impedit velit voluptatem assumenda possimus ut nesciunt eum et deleniti molestias harum excepturi
N/A,N/A,perferendis quae est velit ipsa autem adipisci ex rerum voluptatem occaecati velit perferendis aut tenetur deleniti eaque quasi suscipit dolorum nobis vel et aut est eos
N/A,N/A,doloribus illum tempora aliquam qui perspiciatis dolorem ratione velit facere nobis et fugiat modi fugiat dolore at ducimus voluptate porro qui architecto optio unde deleniti
N/A,N/A,provident sed similique explicabo fugiat quasi saepe voluptatem corrupti recusandae voluptas repudiandae illum tenetur mollitia sint in enim earum est
N/A,N/A,est quo quod tempora fuga debitis eum nihil nemo nisi consequatur sequi nesciunt dolorum et cumque maxime qui consequatur mollitia dicta iusto aut vero recusandae ut dolorem provident voluptatibus suscipit sint
N/A,N/A,quibusdam dolores eveniet qui minima magni perspiciatis pariatur ullam dolor sit ex molestiae in nulla unde rerum quibusdam deleniti nisi
N/A,N/A,unde aliquam ipsam eaque quia laboriosam exercitationem totam illo non et dolore ipsa laborum et sapiente fugit voluptatem et debitis quia optio et minima et nostrum
N/A,N/A,neque ullam eos amet ratione architecto doloribus qui est nisi occaecati unde expedita perspiciatis animi tenetur minus eveniet aspernatur eius nihil adipisci aut
N/A,N/A,veritatis laudantium laboriosam ut maxime sed voluptate consequatur itaque occaecati voluptatum est ut itaque aperiam eligendi at vel minus dicta tempora nihil pariatur libero est
N/A,N/A,ullam modi consequatur officia dolor non explicabo et eum minus dicta dolores blanditiis dolore nobis assumenda harum velit ullam et cupiditate et commodi dolor harum et sed cum reprehenderit omnis
N/A,N/A,aperiam quo quis nobis error et culpa veritatis quae sapiente nobis architecto doloribus quia laboriosam est consequatur et recusandae est eius
N/A,N/A,itaque voluptatem voluptas velit non est rerum incidunt vitae aut labore accusantium in atque repudiandae quos necessitatibus autem ea excepturi
N/A,N/A,ea iusto laboriosam sit voluptatibus magni ratione eum et minus perferendis eius rerum suscipit velit culpa ipsa ipsam aperiam est
N/A,N/A,itaque error cupiditate asperiores ut aspernatur veniam qui doloribus sit aliquid pariatur dicta deleniti qui alias dignissimos recusandae eaque repellendus est et dolorem aut non explicabo voluptas est beatae vel temporibus
N/A,N/A,aut culpa quis modi libero hic dolore provident officiis placeat minima vero et iste dolores aut voluptatem saepe unde vero temporibus sunt corrupti voluptate
N/A,N/A,et nostrum cupiditate nobis facere et est illo consequatur harum voluptatem totam molestiae voluptas consequatur quibusdam aut modi impedit necessitatibus et nisi nesciunt adipisci
N/A,N/A,esse rem ut neque magni voluptatem id qui aut ut vel autem non qui quam sit impedit quis sit illum laborum aut at vel eos nihil quo
N/A,N/A,necessitatibus nulla perferendis ad inventore earum delectus vitae illo sed perferendis officiis quo eligendi voluptatem animi totam perspiciatis repellat quam eum placeat est tempore facere
N/A,N/A,quisquam asperiores voluptas modi tempore officia quod hic dolor omnis asperiores architecto aut vel odio quisquam sunt deserunt soluta illum
N/A,N/A,dolores minus sequi laudantium excepturi deserunt rerum voluptatem pariatur harum natus sed dolore quis consectetur quod inventore laboriosam et in dolor beatae rerum quia rerum qui recusandae quo officiis fugit
N/A,N/A,rem ut cumque tempore sed aperiam unde tenetur ab maiores officiis alias aut nemo veniam dolor est eum sunt a esse ratione deserunt et
N/A,N/A,est et itaque qui laboriosam dolor ut debitis cumque et et dolor eaque enim et architecto et quia reiciendis quis
N/A,N/A,vel nam nemo sed vitae repellat necessitatibus dolores deserunt dolorum minima quae velit et nemo sit expedita nihil consequatur autem quia maiores
N/A,N/A,quia est sed eos animi optio dolorum consequatur reiciendis exercitationem ipsum nihil omnis beatae sed corporis enim quisquam et blanditiis qui nihil
N/A,N/A,explicabo nam nihil atque sint aut qui qui rerum excepturi soluta quis et et mollitia et voluptate minima nihil sed quaerat dolor earum tempore et non est voluptatem
N/A,N/A,assumenda aut quis repellendus nihil impedit cupiditate nemo sit sequi laudantium aut voluptas nam dolore magnam minima aspernatur vero sapiente
N/A,N/A,non repudiandae dicta et commodi sint dolores facere eos nesciunt autem quia placeat quaerat non culpa quasi dolores voluptas dolorum placeat non atque libero odit autem sunt
N/A,N/A,doloremque quae ratione cumque excepturi eligendi delectus maiores necessitatibus veniam fugiat exercitationem consectetur vel earum quia illo explicabo molestiae enim rem deserunt et omnis
N/A,N/A,sit vero at voluptatem corporis adipisci error sit aut nihil rerum doloremque dolorum ipsum eum ut numquam sapiente ipsam nam blanditiis ut quasi facilis optio rerum qui temporibus esse excepturi eaque
N/A,N/A,exercitationem quisquam sed eius et cum reiciendis deleniti non perspiciatis aut voluptatum deserunt sint dignissimos est sed architecto sed
N/A,N/A,debitis dignissimos ut illum rerum voluptatem ut qui labore optio quaerat iure iste consequuntur praesentium vero blanditiis quibusdam aut
N/A,N/A,laboriosam voluptas aut quibusdam mollitia sunt non dolores illum fugiat ex vero nemo aperiam porro quam expedita est vel voluptatem sit voluptas consequuntur quis eligendi omnis id nisi ducimus sapiente odit quam
N/A,N/A,nihil esse aut debitis nostrum mollitia similique minus aspernatur possimus omnis eaque non eveniet rerum qui iure laboriosam
N/A,N/A,nemo deleniti sunt praesentium quis quam repellendus consequatur non est ex fugiat distinctio aliquam explicabo aspernatur omnis debitis sint consequatur quo autem natus veritatis
N/A,N/A,facere at voluptatem repellendus omnis perspiciatis placeat aspernatur nobis blanditiis ut deleniti quis non cumque laborum sit id ratione vel sequi facere doloremque beatae aut maxime non
N/A,N/A,aut cum sint qui facere blanditiis magnam consequuntur perspiciatis harum impedit reprehenderit iste doloribus quia quo facere et explicabo aut voluptate modi dolorem rem aut nobis ut ad voluptatum ipsum eos maxime
N/A,N/A,itaque occaecati non aspernatur velit repudiandae sit rerum esse quibusdam unde molestias explicabo dolorem vero consequatur quis et libero voluptatem totam vel sapiente autem dolorum consequuntur
N/A,N/A,aliquid molestias nemo aut est maxime laboriosam et consequatur laudantium commodi et corrupti harum quasi minima ratione sint magni sapiente ut
N/A,N/A,sapiente qui est quod debitis qui est optio consequuntur alias hic amet ut non ad qui provident quia provident aspernatur corrupti occaecati
N/A,N/A,similique harum iste ipsam non dolores facere esse et beatae error necessitatibus laboriosam fugiat culpa esse occaecati ut provident ut et dolorum nam delectus impedit aut blanditiis fugiat est unde
N/A,N/A,debitis dolore est ut eos velit accusamus non nobis ipsa nemo quas facilis quia hic officia quam et possimus voluptas voluptatem quisquam tempore delectus
N/A,N/A,consectetur maiores ab est qui aliquid porro ipsa labore incidunt iste deserunt quia aperiam quis sit perferendis et sint iste
N/A,N/A,et quibusdam saepe labore delectus et earum quis perferendis laborum soluta veritatis ea veritatis quidem accusantium est aut porro rerum quia est consequatur voluptatem numquam laudantium repellendus
N/A,N/A,non et voluptas eaque atque esse qui molestias porro quam veniam voluptatibus minima ut velit velit ut architecto deleniti ab sint deserunt possimus quas velit et eum
N/A,N/A,magnam similique animi eos explicabo natus provident cumque sit maxime velit veritatis fuga esse dolor hic nihil nesciunt assumenda aliquid vero modi alias qui quia doloribus est
N/A,N/A,velit earum perspiciatis ea recusandae nihil consectetur ut maxime repellendus doloribus aperiam ut ex ratione quia esse magni ducimus rerum vel rerum officiis suscipit nihil qui
N/A,N/A,quos sed unde repudiandae aut porro dignissimos qui occaecati sed alias enim voluptates nesciunt sit ut adipisci est expedita quae corrupti
N/A,N/A,quas placeat repudiandae a delectus facere exercitationem consectetur facilis quas sequi est mollitia est vero hic laudantium maiores quisquam itaque aut maxime ut cumque quia doloremque voluptatem
N/A,N/A,quae eaque reprehenderit suscipit facilis ut tenetur blanditiis sint occaecati accusantium expedita sed nostrum rerum sunt nam qui placeat consequatur et
N/A,N/A,consequuntur molestiae aut distinctio illo qui est sequi reprehenderit hic accusamus et officiis reprehenderit culpa est et numquam et eius ipsa rerum velit
N/A,N/A,asperiores et minus non dolor dolorem et sint et ipsam et enim quia sequi sed beatae culpa architecto nisi minima
N/A,N/A,quos illo consectetur dolores cupiditate enim rerum dicta sequi totam aspernatur sed praesentium ipsum voluptates perspiciatis ipsa accusantium et et
N/A,N/A,error et quasi qui facilis enim eum adipisci iste ad nostrum sint corporis quam velit necessitatibus a eius doloribus optio ad qui molestiae quaerat dignissimos voluptatem culpa aliquam explicabo commodi natus
N/A,N/A,dolores tempora totam quas maxime voluptatem voluptas excepturi recusandae quis odio exercitationem in consectetur sed aut excepturi eligendi sint consectetur repellendus aperiam
N/A,N/A,nihil ratione aliquam recusandae ipsa sunt doloribus labore molestiae officia cum aliquid repudiandae et error inventore minima optio repellat aut ea et maxime alias voluptas eius
N/A,N/A,corporis perferendis dolorum error quo rerum aut odio veritatis sit deleniti aut eligendi quam doloremque aut ipsam sint doloribus id voluptatem esse reprehenderit molestiae quia voluptatem incidunt illo beatae nihil corporis eligendi iure quo
N/A,N/A,natus atque ipsum voluptatem et necessitatibus atque quia asperiores animi odit ratione quos est repellendus sit aut repudiandae animi aut cum blanditiis repudiandae saepe laborum
N/A,N/A,perferendis fugit expedita cumque exercitationem animi fugit aut earum nihil quia illum eum dicta ut quam commodi optio
N/A,N/A,eius voluptatem minus et aliquid perspiciatis sint unde ut similique odio ullam vitae quisquam hic ex consequatur aliquid ab nihil explicabo sint maiores aut et dolores nostrum
N/A,N/A,ea consequatur placeat quo omnis illum voluptatem voluptatem fugit aut dolorum recusandae ut et tenetur officia voluptas
N/A,N/A,perspiciatis omnis eum nihil et porro facilis fuga qui deleniti id et velit adipisci fuga voluptatibus voluptatum debitis tempore dolorem atque consequatur ea perspiciatis sed qui temporibus doloremque
N/A,N/A,rem ut sed non cumque corrupti vel nam rerum autem nobis dolorem necessitatibus fugit corporis quos sint distinctio ex et animi tempore
N/A,N/A,est accusamus facere reprehenderit corporis ad et est fugit iure nulla et doloribus reiciendis quasi autem voluptas ipsam labore et pariatur quia
N/A,N/A,doloremque accusantium necessitatibus architecto ut provident quaerat iusto eius omnis fuga laborum harum totam sunt velit aut neque corporis atque
