Name,Title,Body
N/A,N/A,reprehenderit molestias sit nemo quas culpa dolorem exercitationem eos est voluptatem dolores est fugiat dolorem eos aut quia et amet et beatae harum vitae officia quia animi dicta magnam accusantium
N/A,N/A,sit non facilis commodi sapiente officiis aut facere libero sed voluptatum eligendi veniam velit explicabo sint laborum sunt reprehenderit dolore id nobis accusamus fugit voluptatem magni dolor qui dolores ipsa
N/A,N/A,suscipit ab qui eos et commodi quas ad maiores repellat laboriosam voluptatem exercitationem quibusdam ullam ratione nulla quia iste error dolorem consequatur beatae temporibus fugit
N/A,N/A,voluptas aspernatur eveniet quod id numquam dolores quia perspiciatis eum et delectus quia occaecati adipisci nihil velit accusamus esse minus aspernatur repudiandae
N/A,N/A,cupiditate laborum sit reprehenderit ratione est ad corporis rem pariatur enim et omnis dicta nobis molestias quo corporis et nihil sed et impedit aut quisquam natus expedita voluptate at
N/A,N/A,ut nam ut asperiores quis exercitationem aspernatur eligendi autem repellendus est repudiandae quisquam rerum ad explicabo suscipit deserunt eius alias aliquid eos pariatur rerum magnam provident iusto
N/A,N/A,illum qui quis optio quasi eius dolores et non numquam et qui necessitatibus itaque magnam mollitia earum et nisi voluptate eum accusamus ea
N/A,N/A,velit ut incidunt accusantium suscipit animi officia iusto nemo omnis sunt nobis repellendus corporis consequatur distinctio dolorem
N/A,N/A,reiciendis et distinctio qui totam non aperiam voluptas veniam in dolorem pariatur itaque voluptas adipisci velit qui voluptates voluptas ut ullam veritatis repudiandae
N/A,N/A,eligendi labore aut non modi vel facere qui accusamus qui maxime aperiam totam et non ut repudiandae eum corrupti pariatur quia necessitatibus et adipisci ipsa consequuntur enim et nihil vero
N/A,N/A,est consequuntur cumque quo dolorem at ut dolores consequatur quia voluptates reiciendis vel rerum id et
N/A,N/A,cum fugit earum vel et nulla et voluptatem et ipsam aut et nihil officia nemo eveniet accusamus nulla aut impedit veritatis praesentium
N/A,N/A,rerum omnis voluptatem harum aliquid voluptas accusamus eius dicta animi odio non quidem voluptas tenetur nostrum deserunt laudantium culpa dolorum
N/A,N/A,odio maxime beatae ab labore rerum alias ipsa nam est nostrum et debitis aut ab molestias assumenda eaque repudiandae
N/A,N/A,dolor at accusantium eveniet in voluptatem quam et fugiat et quasi dolores sunt eligendi voluptatum id voluptas vitae quibusdam iure eum perspiciatis
N/A,N/A,et provident quo necessitatibus harum excepturi sed est ut sed est doloremque labore quod quia optio explicabo adipisci magnam doloribus veritatis illo aut est inventore
N/A,N/A,dolor veritatis ipsum accusamus quae voluptates sint voluptatum et harum saepe dolorem enim expedita placeat qui quidem aut et et est minus odit qui possimus qui saepe
N/A,N/A,ratione sequi sed earum nam aut sunt quam cum qui similique consequatur et est
N/A,N/A,quidem nisi reprehenderit eligendi fugiat et et sapiente adipisci natus nulla similique et est esse ea accusantium sunt deleniti molestiae perferendis quam animi similique ut
N/A,N/A,consequatur accusamus maiores dolorem impedit repellendus voluptas rerum eum quam quia error voluptatem et dignissimos fugit qui et facilis necessitatibus dignissimos consequatur iusto nihil possimus
N/A,N/A,animi qui nostrum rerum velit voluptates sit in laborum dolorum omnis ut omnis ea optio quia necessitatibus delectus molestias sapiente perferendis dolores vel excepturi expedita
N/A,N/A,sunt ipsam illum consequuntur quasi enim possimus unde qui beatae quo eligendi vel quia asperiores est quae voluptate aperiam et iste perspiciatis
N/A,N/A,incidunt itaque enim pariatur quibusdam voluptatibus blanditiis sint error laborum voluptas sed officiis molestiae nostrum temporibus culpa aliquam sit consectetur dolores tempore id accusantium dignissimos vel
N/A,N/A,eos hic deserunt necessitatibus sed id ut esse nam hic eveniet vitae corrupti mollitia doloremque sit ratione deleniti perspiciatis numquam est sapiente quaerat est est sit
N/A,N/A,veniam natus aut vero et aliquam doloremque alias cupiditate non est tempore et non vel error placeat est quisquam ea non dolore aliquid non fuga expedita dicta ut quos
N/A,N/A,qui qui deserunt expedita at provident sequi veritatis sit qui nam tempora mollitia ratione corporis vitae rerum pariatur unde deleniti ut eos ad aut non quae nisi saepe
N/A,N/A,eos quidem temporibus eum est ipsa sunt illum a facere omnis suscipit dolorem voluptatem incidunt tenetur deleniti aspernatur at quis
N/A,N/A,adipisci et accusantium hic deserunt voluptates consequatur omnis quod dolorem voluptatibus quis velit laboriosam mollitia illo et iure aliquam dolorem nesciunt laborum aperiam labore repellat et maxime itaque
N/A,N/A,voluptate officiis nihil laudantium sint autem adipisci aspernatur voluptas debitis nam omnis ut non eligendi aliquam vel commodi velit officiis laboriosam corporis quas aliquid aperiam autem
N/A,N/A,consequatur aliquam illum quis facere vel voluptatem rem sint atque in nam autem impedit dolores enim soluta rem adipisci odit sint voluptas aliquam
N/A,N/A,ex corrupti ut pariatur voluptas illo labore non voluptates voluptas sint et est impedit cum in fugiat cumque eum id rerum error ut rerum voluptates facilis molestiae et labore voluptatem corrupti
N/A,N/A,aut dignissimos eos facere velit totam eaque aut voluptas ex similique ut ipsa est voluptates ut tempora quis commodi officia et consequatur cumque delectus
N/A,N/A,deleniti fuga hic autem sed rerum non voluptate sit totam consequuntur illo quasi quod aut ducimus dolore distinctio molestias non velit quis debitis cumque voluptas
N/A,N/A,facilis repellendus inventore aperiam corrupti saepe culpa velit dolores sint ut aut quis voluptates iure et a neque harum quia similique sunt eum voluptatem a
N/A,N/A,dolor unde numquam distinctio ducimus eum hic rerum non expedita dolores et dignissimos rerum perspiciatis et porro est minus
N/A,N/A,molestias incidunt eaque numquam reprehenderit rerum ut ex ad omnis porro maiores quaerat harum nihil non quasi ea asperiores quisquam sunt fugiat eos natus iure adipisci
N/A,N/A,quia non dolor corporis consectetur velit eos quis incidunt ut eos nesciunt repellendus voluptas voluptate sint neque doloribus est minima autem quis velit illo ea neque
N/A,N/A,et necessitatibus earum qui velit id explicabo harum optio dolor dolores reprehenderit in a itaque odit esse et et id possimus est ut consequuntur velit autem iure ut
N/A,N/A,quod corrupti eum quisquam rerum accusantium tempora reprehenderit qui voluptate et sunt optio et iusto nihil amet omnis labore cumque quo saepe omnis aut quia consectetur
N/A,N/A,tempora sint qui iste itaque non neque qui suscipit enim quas rerum totam impedit esse nulla praesentium natus explicabo doloremque atque maxime mollitia impedit dolorem occaecati officia in provident eos
N/A,N/A,ut in nostrum ut et incidunt et minus nulla perferendis libero delectus nulla nemo deleniti deleniti facere autem vero velit non molestiae assumenda
N/A,N/A,officia quas aut culpa eum eaque quia rem unde ea quae reiciendis omnis excepturi nemo est vel sequi accusantium tenetur at earum et rerum quisquam temporibus cupiditate
N/A,N/A,nulla veniam quo consequuntur ullam autem nisi error aut facere distinctio rerum quia tempore velit distinctio occaecati ducimus ratione similique doloribus
N/A,N/A,non similique illo quia et rem placeat reprehenderit voluptas velit officiis fugit blanditiis nihil ab deserunt ullam
N/A,N/A,totam explicabo harum quam impedit sunt doloremque consectetur id et minima eos incidunt quibusdam omnis saepe maiores officiis eligendi alias sint est aut cumque debitis cumque hic aut ut dolorum
N/A,N/A,tenetur qui ut architecto officiis voluptatem velit eos molestias incidunt eum dolorum distinctio quam et sequi consequatur nihil voluptates animi
N/A,N/A,dignissimos nobis vitae corporis delectus eligendi et ut ut amet laudantium neque et quia cupiditate debitis aliquid dolorem aspernatur libero aut autem quo et
N/A,N/A,aliquid natus voluptas doloremque fugiat ratione adipisci unde eum facilis enim omnis ipsum nobis nihil praesentium ut blanditiis voluptatem veniam tenetur fugit et distinctio aspernatur
N/A,N/A,quos aut rerum nihil est et dolores commodi voluptas voluptatem excepturi et et expedita dignissimos atque aut reprehenderit quis quo soluta
N/A,N/A,vel libero quo sit vitae id nesciunt ipsam non a aut enim itaque totam illum est cupiditate sit nam exercitationem magnam veniam
N/A,N/A,soluta quia porro mollitia eos accusamus voluptatem illo perferendis earum quia quo sed ipsam in omnis cum earum tempore eos voluptatem illum doloremque corporis ipsam facere
N/A,N/A,iste maxime et molestiae qui aliquam doloremque earum beatae repellat in aut eum libero eos itaque pariatur exercitationem vel quam non
N/A,N/A,sint delectus nesciunt ipsum et aliquid et libero aut suscipit et molestiae nemo pariatur sequi repudiandae ea placeat neque quas eveniet mollitia quae laboriosam
N/A,N/A,aut sunt recusandae laboriosam omnis asperiores et nulla ipsum rerum quis doloremque rerum optio mollitia provident sed iste aut id numquam repudiandae veritatis
N/A,N/A,et dolorem sit reprehenderit sapiente occaecati iusto sit impedit nobis ut quia maiores debitis pariatur nostrum et aut assumenda error qui deserunt laborum quaerat et
N/A,N/A,minus nihil sunt dolor ipsum a illum quis quasi officiis cupiditate architecto sit consequatur ut et sed quasi quam doloremque
N/A,N/A,natus commodi debitis cum ex rerum alias quis maxime fugiat fugit sapiente distinctio nostrum tempora possimus quod vero itaque enim accusantium perferendis fugit ut eum labore accusantium voluptas
N/A,N/A,iure deleniti aut consequatur necessitatibus id atque voluptas mollitia voluptates doloremque dolorem repudiandae hic enim laboriosam consequatur velit minus
N/A,N/A,est eos doloremque autem similique sint fuga atque voluptate est minus tempore quia asperiores aliquam et corporis voluptatem consequatur et eum illo aut qui molestiae et amet
N/A,N/A,est illum quia alias ipsam minus ut quod vero aut magni harum quis ab minima voluptates nemo non sint quis distinctio officia ea et maxime
N/A,N/A,pariatur occaecati ea autem at quis et dolorem similique pariatur ipsa hic et saepe itaque cumque repellendus vel et quibusdam qui aut nemo et illo qui non quod officiis aspernatur qui optio
N/A,N/A,neque unde voluptatem iure odio excepturi ipsam ad id ipsa sed expedita error quam voluptatem tempora necessitatibus suscipit culpa veniam porro iste vel
N/A,N/A,non dolor consequatur laboriosam ut deserunt autem odit libero dolore non nesciunt qui aut est consequatur quo dolorem
N/A,N/A,aliquam pariatur suscipit fugiat eos sunt optio voluptatem eveniet rerum dignissimos quia aut beatae modi consequatur qui rerum sint veritatis deserunt est
N/A,N/A,et necessitatibus tempora ipsum quaerat inventore est quasi quidem ea repudiandae laborum omnis ab reprehenderit ut ratione sit numquam culpa a rem atque aut et
N/A,N/A,perspiciatis quis doloremque veniam nisi eos velit sed id totam inventore voluptatem laborum et eveniet aut aut aut maxime quia temporibus ut omnis
